Id,Description,Type,Tags,Status,Formalization,Notes
ELS-39-A,"If the brake pedal is deflected more than 3°, all brake lamps (brake lamp left, brake lamp right and brake lamp middle) have to be activated until the deflection is lower than 1° again.",ELS,,,,
ELS-40,"If the brake pedal is deflected more than 40.0° (i.e. full-brake application), the third brake lamp in the middle flashes with pulse ratio bright to dark 1:1 and a frequency of 6 ± 1 Hz (i.e. 360 ± 60 flashes per minute). The flashing stops only when the brake pedal is completely released.",Ignore,,,,
ELS-40-A,"If the brake pedal is deflected more than 40.0° (i.e. full-brake application), the brake lamp middle flashes with pulse ratio bright to dark 1:1 and a frequency of 6 ± 1 Hz (i.e. 360 ± 60 flashes per minute). The flashing stops only when the brake pedal is completely released.",ELS,,,,
other015,"Reverse light indicates that the reverse gear in engaged, i.e. the vehicle will move backwards.",Other,,,,
ELS-41,The reverse light is activated whenever the reverse gear is engaged.,ELS,,,,
other016,Fault handling. A malfunctioning lighting system is safety critical and must therefore be avoided. E.g. the failure of individual lamps is checked using a hardware circuit and indicated to the driver accordingly. In the following we describe how the software should react to over- or subvoltage in order to guarantee the most important functionality for as long as possible.,Other,,,,
ELS-42,"A subvoltage is present if the voltage in the vehicle electrical system is less than 8.5V. With subvoltage, the adaptive high beam headlight is not available.",Ignore,,,,
ELS-42-A,A subvoltage is present if the voltage in the vehicle electrical system is less than 8.5V.,ELS,,,,
ELS-42-B,"With subvoltage, the adaptive high beam headlight is not available.",ELS,,,,
ELS-43,"If the light rotary switch is in position Auto and the pitman arm is pulled, the high beam headlight is activated (see Req. ELS-31) even in case of subvoltage.",ELS,,,,check me. Evtl. Von els31 runterziehen
ELS-44,With subvoltage the ambient light is not available.,ELS,,,,
ELS-45,With subvoltage the cornering light is not available.,ELS,,,,
ELS-46,With subvoltage an activated parking light is switched off.,ELS,,,,
ELS-47,"An overvoltage is present if the voltage in the vehicle electrical system is more than 14.5V. With overvoltage, all lights must be activated with a light intensity of (100-(voltage-14.5)*20)%. This reduction serves the protection of the illuminant (protection from \"burning out\").",Ignore,,,,
ELS-47-A,An overvoltage is present if the voltage in the vehicle electrical system is more than 14.5V.,ELS,,,,
ELS-47-B,"With overvoltage, all lights must be activated with a light intensity of (100-(voltage-14.5)*20)%. This reduction serves the protection of the illuminant (protection from \"burning out\").",ELS,,,,
ELS-48,"With overvoltage, the illumination area requirements do not need to be respected (see Req. ELS-33 and Req. ELS-36).",ELS,,,,
ELS-49,"If the camera is not Ready, adaptive high beam headlights is not available. If light rotary switch is in position Auto and the pitman arm is in position 4 (see Req. ELS-32), manual high beam headlights are activated (see Req. ELS-31)",ELS,,,,
other017,"The table in appendix A defines all signals that either reflect the determined input of the various user interfaces and sensors or are used to control the actuators. For the sake of simplicity, all signals are available all the time. There are no timeouts or delays.",Other,,,,
